{
  "$schema": "https://json-schema.org/draft/2020-12/schema",
  "$id": "https://cangqiaoedu.local/schemas/diagnostic-package.schema.json",
  "title": "Brand GEO Diagnostic Package v1",
  "type": "object",
  "additionalProperties": false,
  "required": ["schema_version", "diagnostic_run", "brand_entity_profile", "industry_profile", "measurement_plan", "content_foundation_protocol"],
  "properties": {
    "schema_version": {"const": "1.0.0"},
    "diagnostic_run": {"$ref": "diagnostic-run.schema.json"},
    "brand_entity_profile": {"$ref": "brand-entity-profile.schema.json"},
    "industry_profile": {"$ref": "industry-profile.schema.json"},
    "measurement_plan": {"$ref": "measurement-plan.schema.json"},
    "content_foundation_protocol": {"$ref": "content-foundation-protocol.schema.json"}
  }
}
